"Triad","Narration","Listener","OldOrNew","Transcript","Audience","Hedges","Rising Intonation","ID"
3,2,1,"Old","and it’s it he starts off in slow motion again",NA,NA,NA,"3-2-1-Old"
3,2,1,"Old","and then it eventually catches up to speed",NA,NA,NA,"3-2-1-Old"
3,2,1,"Old","and then the roadrunner",NA,NA,NA,"3-2-1-Old"
3,2,1,"Old","catches up and he runs from coyote",NA,NA,NA,"3-2-1-Old"
3,2,1,"Old","and he’s started",NA,NA,NA,"3-2-1-Old"
3,2,1,"Old","and he’s started thinking about how to catch him",NA,NA,NA,"3-2-1-Old"
3,2,1,"Old","and he uses this contraption",NA,NA,NA,"3-2-1-Old"
3,2,1,"Old","uh this metal thing he puts around a rock",NA,NA,NA,"3-2-1-Old"
3,2,1,"Old","and with a boxing glove on a spring",NA,NA,NA,"3-2-1-Old"
3,2,1,"Old","and he’s just got to pull a string that will",NA,NA,NA,"3-2-1-Old"
3,2,1,"Old","that will launch the boxing glove",NA,NA,NA,"3-2-1-Old"
3,2,1,"Old","instead of um",NA,NA,NA,"3-2-1-Old"
3,2,1,"Old","when the roadrunner runs",NA,NA,NA,"3-2-1-Old"
3,2,1,"Old","instead of it working to his advantage it backfired",NA,NA,NA,"3-2-1-Old"
3,2,1,"Old","and the rock ends up um catapulting him into another rock",NA,NA,NA,"3-2-1-Old"
3,2,1,"Old","and then the boxing glove eventually comes back",NA,NA,NA,"3-2-1-Old"
3,2,1,"Old","a few minutes uh a few seconds later",NA,NA,NA,"3-2-1-Old"
3,2,1,"Old","and hits him in the face",NA,NA,NA,"3-2-1-Old"
3,2,1,"Old","and then uh then he um he gets uh blue",NA,NA,NA,"3-2-1-Old"
3,2,1,"Old","he’s looking at blueprints for another acme contraption that he has",NA,NA,NA,"3-2-1-Old"
3,2,1,"Old","and he ends up trying to walk across a really thin rope",NA,NA,NA,"3-2-1-Old"
3,2,1,"Old","between that’s tied between to cliffs ?",NA,NA,"?","3-2-1-Old"
3,2,1,"Old","and he has an anvil in his hands ?",NA,NA,"?","3-2-1-Old"
3,2,1,"Old","and he gets about uh a few feet in onto it",NA,NA,NA,"3-2-1-Old"
3,2,1,"Old","and he ends up being lunged down to the ground",NA,NA,NA,"3-2-1-Old"
3,2,1,"Old","with the anvil in his hand",NA,NA,NA,"3-2-1-Old"
3,2,1,"Old","and the roadrunner comes in",NA,NA,NA,"3-2-1-Old"
3,2,1,"Old","and looks at him",NA,NA,NA,"3-2-1-Old"
3,2,1,"Old","and sticks out his tongue and goes MEEP MEEP",NA,NA,NA,"3-2-1-Old"
3,2,1,"Old","and runs away",NA,NA,NA,"3-2-1-Old"
3,2,1,"Old","and then he tries to go after him and realizes that",NA,NA,NA,"3-2-1-Old"
3,2,1,"Old","he let go of the anvil",NA,NA,NA,"3-2-1-Old"
3,2,1,"Old","and then gets catapulted up into the sky",NA,NA,NA,"3-2-1-Old"
3,2,1,"Old","he ha luckily for him he had a backpack",NA,NA,NA,"3-2-1-Old"
3,2,1,"Old","or so he thought",NA,NA,NA,"3-2-1-Old"
3,2,1,"Old","and he presses a stri he pulls the string",NA,NA,NA,"3-2-1-Old"
3,2,1,"Old","and everything but a parachute comes out",NA,NA,NA,"3-2-1-Old"
3,2,1,"Old","and he",NA,NA,NA,"3-2-1-Old"
3,2,1,"Old","falling and falling",NA,NA,NA,"3-2-1-Old"
3,2,1,"Old","he has this acme aspirin in his hand",NA,NA,NA,"3-2-1-Old"
3,2,1,"Old","and he opens it",NA,NA,NA,"3-2-1-Old"
3,2,1,"Old","and all of them go up in front of like all up in the air",NA,"like",NA,"3-2-1-Old"
3,2,1,"Old","and he tri manages just to get a few of them",NA,NA,NA,"3-2-1-Old"
3,2,1,"Old","and pops them like takes them",NA,"like",NA,"3-2-1-Old"
3,2,1,"Old","and looks at the screen and goes like this",NA,NA,NA,"3-2-1-Old"
3,2,1,"Old","and ends up falling",NA,NA,NA,"3-2-1-Old"
3,2,1,"Old","into a big cloud of smoke on the ground",NA,NA,NA,"3-2-1-Old"
3,2,1,"Old","fatually eventually he catches up with the roadrunner",NA,NA,NA,"3-2-1-Old"
3,2,1,"Old","and follows him into the old cactus mine",NA,NA,NA,"3-2-1-Old"
3,2,1,"Old","and keeps running and running and realizes he can’t see anything",NA,NA,NA,"3-2-1-Old"
3,2,1,"Old","so he runs back out",NA,NA,NA,"3-2-1-Old"
3,2,1,"Old","to the beginning where there’s a hard hat with a light ? grabs that",NA,NA,"?","3-2-1-Old"
3,2,1,"Old","and the roadrunner’s there",NA,NA,NA,"3-2-1-Old"
3,2,1,"Old","with one in green and he’s got one in red",NA,NA,NA,"3-2-1-Old"
3,2,1,"Old","and then they chase each other through the mine shafts for quite a while",NA,NA,NA,"3-2-1-Old"
3,2,1,"Old","and then he finally ca closing in on him",NA,NA,NA,"3-2-1-Old"
3,2,1,"Old","he runs through a mine shaft that’s pretty oddly shaped",NA,NA,NA,"3-2-1-Old"
3,2,1,"Old","and um as a result his um",NA,NA,NA,"3-2-1-Old"
3,2,1,"Old","his hard hat and the light in the hard hat ends up breaking",NA,NA,NA,"3-2-1-Old"
3,2,1,"Old","and he loses the roadrunner",NA,NA,NA,"3-2-1-Old"
3,2,1,"Old","however he lights a match then to find out where he’s at",NA,NA,NA,"3-2-1-Old"
3,2,1,"Old","and he ends up being in a mine where there’s a bunch of dynamite",NA,NA,NA,"3-2-1-Old"
3,2,1,"Old","and um it explodes",NA,NA,NA,"3-2-1-Old"
3,2,1,"Old","over underneath a patch of cactus",NA,NA,NA,"3-2-1-Old"
3,2,1,"Old","that when it explodes it forms the word YIPE",NA,NA,NA,"3-2-1-Old"
3,3,2,"New","it’s a uh roadrunner and coyote cartoon",NA,NA,NA,"3-3-2-New"
3,3,2,"New","and it starts off with",NA,NA,NA,"3-3-2-New"
3,3,2,"New","the two of them chasing each other",NA,NA,NA,"3-3-2-New"
3,3,2,"New","and like uh you see a cloud of color it’s all you see",NA,"like",NA,"3-3-2-New"
3,3,2,"New","and slow it goes to slow motion",NA,NA,NA,"3-3-2-New"
3,3,2,"New","and you see the roadrunner",NA,NA,NA,"3-3-2-New"
3,3,2,"New","and you see the coyote uh a few feet behind him",NA,NA,NA,"3-3-2-New"
3,3,2,"New","with um a fork and a knife in his hand and uh",NA,NA,NA,"3-3-2-New"
3,3,2,"New","a bib around his neck",NA,NA,NA,"3-3-2-New"
3,3,2,"New","and it it it start it get",NA,NA,NA,"3-3-2-New"
3,3,2,"New","then it starts off again in slow motion and you still see them",NA,NA,NA,"3-3-2-New"
3,3,2,"New","and then it get uh",NA,NA,NA,"3-3-2-New"
3,3,2,"New","I guess the thing catches up to speed with the roadrunner",NA,"I guess",NA,"3-3-2-New"
3,3,2,"New","and wand and is like out of the picture by that time",NA,"like",NA,"3-3-2-New"
3,3,2,"New","he’s run away from the coyote",NA,NA,NA,"3-3-2-New"
3,3,2,"New","and the coyote left um thinking about how to catch him",NA,NA,NA,"3-3-2-New"
3,3,2,"New","and he comes up with this contraption",NA,NA,NA,"3-3-2-New"
3,3,2,"New","and you you pl",NA,NA,NA,"3-3-2-New"
3,3,2,"New","and it was a metal contraption he placed around a rock",NA,NA,NA,"3-3-2-New"
3,3,2,"New","and it has um a spring with a boxing glove at the end",NA,NA,NA,"3-3-2-New"
3,3,2,"New","that all he has to do is um pull a string",NA,NA,NA,"3-3-2-New"
3,3,2,"New","and it should catapult thee boxing glove",NA,NA,NA,"3-3-2-New"
3,3,2,"New","so he’s standing behind it",NA,NA,NA,"3-3-2-New"
3,3,2,"New","as the roadrunner comes running past him",NA,NA,NA,"3-3-2-New"
3,3,2,"New","and pulls the string",NA,NA,NA,"3-3-2-New"
3,3,2,"New","however it backfires",NA,NA,NA,"3-3-2-New"
3,3,2,"New","and it sends the rock that was in catapulting into him into another rock",NA,NA,NA,"3-3-2-New"
3,3,2,"New","and then a few seconds later the the boxing glove with the spring",NA,NA,NA,"3-3-2-New"
3,3,2,"New","falls and hits him in the face",NA,NA,NA,"3-3-2-New"
3,3,2,"New","then the and then he gets blueprints for another acme contraption",NA,NA,NA,"3-3-2-New"
3,3,2,"New","that he um it ih",NA,NA,NA,"3-3-2-New"
3,3,2,"New","it was a line tied between two cliffs",NA,NA,NA,"3-3-2-New"
3,3,2,"New","and he has an anvil in his hands and he starts walking across it",NA,NA,NA,"3-3-2-New"
3,3,2,"New","and he gets sent down to the bottom the ground",NA,NA,NA,"3-3-2-New"
3,3,2,"New","with an anvil in his hand",NA,NA,NA,"3-3-2-New"
3,3,2,"New","and then the roadrunner comes up to him",NA,NA,NA,"3-3-2-New"
3,3,2,"New","and he goes this time he goes MEEP MEEP",NA,NA,NA,"3-3-2-New"
3,3,2,"New","and um he tri he lets go of the anvil and tries to run after him",NA,NA,NA,"3-3-2-New"
3,3,2,"New","but then the line shsh sends him catapulting into the air",NA,NA,NA,"3-3-2-New"
3,3,2,"New","and he and he had an expression that said like uh",NA,"like",NA,"3-3-2-New"
3,3,2,"New","luckily for me I have a book I have a parachute ?",NA,NA,"?","3-3-2-New"
3,3,2,"New","and he went to press the string",NA,NA,NA,"3-3-2-New"
3,3,2,"New","um everything but uh a parachute came out",NA,NA,NA,"3-3-2-New"
3,3,2,"New","and he ends up falling",NA,NA,NA,"3-3-2-New"
3,3,2,"New","and he has an acme in his hand he has an acme aspirin container ?",NA,NA,"?","3-3-2-New"
3,3,2,"New","and aspirin fa",NA,NA,NA,"3-3-2-New"
3,3,2,"New","he opens it",NA,NA,NA,"3-3-2-New"
3,3,2,"New","and aspirin goes and fli like falls on top of him ?",NA,"like","?","3-3-2-New"
3,3,2,"New","and he’s managed to grab two three of them and he ea takes them",NA,NA,NA,"3-3-2-New"
3,3,2,"New","and he ends up looking at the screen going like this",NA,NA,NA,"3-3-2-New"
3,3,2,"New","and he falls to the ground",NA,NA,NA,"3-3-2-New"
3,3,2,"New","in like a cloud of smoke",NA,"like",NA,"3-3-2-New"
3,3,2,"New","he eventually catches up with the roadrunner",NA,NA,NA,"3-3-2-New"
3,3,2,"New","and follows him into the old cactus mine",NA,NA,NA,"3-3-2-New"
3,3,2,"New","and he’s running he ran into it",NA,NA,NA,"3-3-2-New"
3,3,2,"New","and kept running and it was pitch black",NA,NA,NA,"3-3-2-New"
3,3,2,"New","so he ran out at the begin to the beginning at the front",NA,NA,NA,"3-3-2-New"
3,3,2,"New","and grabbed a hard hat with a light on it",NA,NA,NA,"3-3-2-New"
3,3,2,"New","and the roadrunner is standing next to him with one in green",NA,NA,NA,"3-3-2-New"
3,3,2,"New","and he had one in red",NA,NA,NA,"3-3-2-New"
3,3,2,"New","and then the next thing you see is um",NA,NA,NA,"3-3-2-New"
3,3,2,"New","running after each other in the mine shafts",NA,NA,NA,"3-3-2-New"
3,3,2,"New","until he finally starts closing in on him",NA,NA,NA,"3-3-2-New"
3,3,2,"New","and then he ends up going to this really weird mine shaft",NA,NA,NA,"3-3-2-New"
3,3,2,"New","where it’s oddly shaped",NA,NA,NA,"3-3-2-New"
3,3,2,"New","and he ends up breaking the light on the hard hat",NA,NA,NA,"3-3-2-New"
3,3,2,"New","and loses the roadrunner in the same thing",NA,NA,NA,"3-3-2-New"
3,3,2,"New","and ends up in s some weird black tunnel",NA,NA,NA,"3-3-2-New"
3,3,2,"New","and he lights a match to see where he’s at",NA,NA,NA,"3-3-2-New"
3,3,2,"New","and he’s in a room full of dynamite",NA,NA,NA,"3-3-2-New"
3,3,2,"New","and it explodes",NA,NA,NA,"3-3-2-New"
3,3,2,"New","and it explodes under a patch of cactus",NA,NA,NA,"3-3-2-New"
3,3,2,"New","where after it explodes it um it forms the word YIPE",NA,NA,NA,"3-3-2-New"
3,3,2,"New","and that’s it",NA,NA,NA,"3-3-2-New"
4,1,1,"New","alright so this was aa uh roadrunner and wile e. coyote cartoon","that’s my favorite",NA,NA,"4-1-1-New"
4,1,1,"New","oh yeah",NA,NA,NA,"4-1-1-New"
4,1,1,"New","so you know it starts with them flying down a road",NA,"you know",NA,"4-1-1-New"
4,1,1,"New","and it stops with you know road runner",NA,"you know",NA,"4-1-1-New"
4,1,1,"New","and then their their made up Latin names",NA,NA,NA,"4-1-1-New"
4,1,1,"New","like acceleris increbilus I think was his",NA,"like, I think",NA,"4-1-1-New"
4,1,1,"New","and then wile e. coyote carnivoruss blathuthuthuthuthu",NA,NA,NA,"4-1-1-New"
4,1,1,"New","and then they start up going you know slowly and slower and slower",NA,"you know",NA,"4-1-1-New"
4,1,1,"New","and just take off",NA,"just",NA,"4-1-1-New"
4,1,1,"New","and uh wile e. coyote stabs at the ground trying to get roadrunner",NA,NA,NA,"4-1-1-New"
4,1,1,"New","and he just takes off as he disappears",NA,"just",NA,"4-1-1-New"
4,1,1,"New","and he just stabs the ground",NA,"just",NA,"4-1-1-New"
4,1,1,"New","he’s mad",NA,NA,NA,"4-1-1-New"
4,1,1,"New","so what’s he trying to do now?",NA,NA,"?","4-1-1-New"
4,1,1,"New","oh he decides to uh get a boxing glove and a spring?",NA,NA,"?","4-1-1-New"
4,1,1,"New","and he puts it on a rock",NA,NA,NA,"4-1-1-New"
4,1,1,"New","and he hides behind a cliff",NA,NA,NA,"4-1-1-New"
4,1,1,"New","and he pushes the spring back",NA,NA,NA,"4-1-1-New"
4,1,1,"New","and clips it to the rock",NA,NA,NA,"4-1-1-New"
4,1,1,"New","so that when the roadrunner goes by he’ll let go of the uh thing",NA,"thing",NA,"4-1-1-New"
4,1,1,"New","and the punging glove will swing out and hit him",NA,NA,NA,"4-1-1-New"
4,1,1,"New","so he hand hides behind the rock",NA,NA,NA,"4-1-1-New"
4,1,1,"New","waits to hear him coming",NA,NA,NA,"4-1-1-New"
4,1,1,"New","hears him coming",NA,NA,NA,"4-1-1-New"
4,1,1,"New","he lifts up the uh hook?",NA,NA,"?","4-1-1-New"
4,1,1,"New","and the rock flies back",NA,NA,NA,"4-1-1-New"
4,1,1,"New","instead of the uh punching glove going forward",NA,NA,NA,"4-1-1-New"
4,1,1,"New","it hits him into the side of a wall he goes out the way it looks",NA,NA,NA,"4-1-1-New"
4,1,1,"New","and the punching glove is flying back and hits him in the face",NA,NA,NA,"4-1-1-New"
4,1,1,"New","didn’t work at all",NA,NA,NA,"4-1-1-New"
4,1,1,"New","so the next one he decides to do",NA,NA,NA,"4-1-1-New"
4,1,1,"New","he puts a tightrope between two cliffs",NA,NA,NA,"4-1-1-New"
4,1,1,"New","and he walks up between the two with an anvil",NA,NA,NA,"4-1-1-New"
4,1,1,"New","and he decides that he’ll drop it on the road runner when he comes by",NA,NA,NA,"4-1-1-New"
4,1,1,"New","but when he walks on the tightrope",NA,NA,NA,"4-1-1-New"
4,1,1,"New","it stretches right down to the ground",NA,NA,NA,"4-1-1-New"
4,1,1,"New","you know he’s standing on the ground with the anvil",NA,"you know",NA,"4-1-1-New"
4,1,1,"New","the roadrunner runs up to him",NA,NA,NA,"4-1-1-New"
4,1,1,"New","does his little BEEP BEEP thing",NA,NA,NA,"4-1-1-New"
4,1,1,"New","runs away",NA,NA,NA,"4-1-1-New"
4,1,1,"New","the coyote gets pissed",NA,NA,NA,"4-1-1-New"
4,1,1,"New","so he throws the anvil on the ground",NA,NA,NA,"4-1-1-New"
4,1,1,"New","shoots up in the air",NA,NA,NA,"4-1-1-New"
4,1,1,"New","now he’s up in the air but he’s looking confident",NA,NA,NA,"4-1-1-New"
4,1,1,"New","you see him turn to the side and this time he’s got a parachute",NA,NA,NA,"4-1-1-New"
4,1,1,"New","so he pulls the parachute cord",NA,NA,NA,"4-1-1-New"
4,1,1,"New","and of course just random crap comes out",NA,"just, random crap",NA,"4-1-1-New"
4,1,1,"New","like a you know a plate and an axe and whatnot",NA,"like, youknow, and whatnot",NA,"4-1-1-New"
4,1,1,"New","so he ta takes out his uh aspirin",NA,NA,NA,"4-1-1-New"
4,1,1,"New","it opens it up",NA,NA,NA,"4-1-1-New"
4,1,1,"New","and all the aspirin flies in the air",NA,NA,NA,"4-1-1-New"
4,1,1,"New","but he gets some he eats it",NA,NA,NA,"4-1-1-New"
4,1,1,"New","waves goodbye to the camera",NA,NA,NA,"4-1-1-New"
4,1,1,"New","as he flies down and hits the ground",NA,NA,NA,"4-1-1-New"
4,1,1,"New","and this time the roadrunner runs into aa cave",NA,NA,NA,"4-1-1-New"
4,1,1,"New","like the old cactus mine","mm-hmm","like",NA,"4-1-1-New"
4,1,1,"New","so coyote follows after him",NA,NA,NA,"4-1-1-New"
4,1,1,"New","runs in it quickly gets dark",NA,NA,NA,"4-1-1-New"
4,1,1,"New","so he turns around picks up one of the lights",NA,NA,NA,"4-1-1-New"
4,1,1,"New","one one of the hats with the lights on it at the front",NA,NA,NA,"4-1-1-New"
4,1,1,"New","and his righ lights are red when he turns it on",NA,NA,NA,"4-1-1-New"
4,1,1,"New","the roadrunner runs up",NA,NA,NA,"4-1-1-New"
4,1,1,"New","the roadrunner’s already got a uh hat with a light",NA,NA,NA,"4-1-1-New"
4,1,1,"New","and his is green",NA,NA,NA,"4-1-1-New"
4,1,1,"New","so they run off",NA,NA,NA,"4-1-1-New"
4,1,1,"New","and it pulls back to this more like generic map thing?",NA,"like, thing","?","4-1-1-New"
4,1,1,"New","where it’s just tunnels through a uh brown background?",NA,"just","?","4-1-1-New"
4,1,1,"New","and you just see their lights?",NA,NA,"?","4-1-1-New"
4,1,1,"New","and you see a green light and a red light chasing each other",NA,NA,NA,"4-1-1-New"
4,1,1,"New","and they’re running around",NA,NA,NA,"4-1-1-New"
4,1,1,"New","and the green light stops",NA,NA,NA,"4-1-1-New"
4,1,1,"New","it cuts back to uh where you actually see the coyote",NA,NA,NA,"4-1-1-New"
4,1,1,"New","and the roadrunner the roadrunner goes down in uh an elevator",NA,NA,NA,"4-1-1-New"
4,1,1,"New","the coyote gets in the other elevator he chases him down",NA,NA,NA,"4-1-1-New"
4,1,1,"New","and they run run run",NA,NA,NA,"4-1-1-New"
4,1,1,"New","you see roadrunner jump over a little cliff and you see the coyote’s light stop back up a little bit try to make the jump not quite make it",NA,NA,NA,"4-1-1-New"
4,1,1,"New","he’s holding on to the edge he just barely climbs up",NA,NA,NA,"4-1-1-New"
4,1,1,"New","and then he and the roadrunner are running around in a circle",NA,NA,NA,"4-1-1-New"
4,1,1,"New","like they’re run and they’ll go down a uh ladder",NA,"like",NA,"4-1-1-New"
4,1,1,"New","around up a ladder","mm-hmm",NA,NA,"4-1-1-New"
4,1,1,"New","and they do that",NA,NA,NA,"4-1-1-New"
4,1,1,"New","and then the roadrunner stops midway once and runs off the other way",NA,NA,NA,"4-1-1-New"
4,1,1,"New","and the coyote just keeps going around in a circle","mm-hmm",NA,NA,"4-1-1-New"
4,1,1,"New","till he realizes chases after the roadrunner",NA,NA,NA,"4-1-1-New"
4,1,1,"New","and then they’re going in a uh jigsaw",NA,NA,NA,"4-1-1-New"
4,1,1,"New","uh not a jigsaw",NA,NA,NA,"4-1-1-New"
4,1,1,"New","like a saw blade up and down up and down up and down","mm-hmm","like",NA,"4-1-1-New"
4,1,1,"New","and they’re chasing after each other",NA,NA,NA,"4-1-1-New"
4,1,1,"New","and at the end uh the coyote is a little far behind",NA,NA,NA,"4-1-1-New"
4,1,1,"New","so the roadrunner goes up",NA,NA,NA,"4-1-1-New"
4,1,1,"New","the coyote doesn’t see it so he goes down at the end",NA,NA,NA,"4-1-1-New"
4,1,1,"New","‘cause there’s two different paths","mm-hmm",NA,NA,"4-1-1-New"
4,1,1,"New","but he’s still hitting the ceiling and the ground the ceiling and the ground",NA,NA,NA,"4-1-1-New"
4,1,1,"New","for being used to running up and down",NA,NA,NA,"4-1-1-New"
4,1,1,"New","and he stops and his hat is broken so he lights a match",NA,NA,NA,"4-1-1-New"
4,1,1,"New","and he’s in a room full of dynamite",NA,NA,NA,"4-1-1-New"
4,1,1,"New","it explodes",NA,NA,NA,"4-1-1-New"
4,1,1,"New","and it cuts to the uh the surface and there’s a bunch of cactuses",NA,NA,NA,"4-1-1-New"
4,1,1,"New","and when it explodes they sh fly up in the air and fall back down",NA,NA,NA,"4-1-1-New"
4,1,1,"New","and they all say YIKES",NA,NA,NA,"4-1-1-New"
4,1,1,"New","and that’s it",NA,NA,NA,"4-1-1-New"
4,2,2,"New","alright so this is a roadrunner and wile e. coyote cartoon",NA,NA,NA,"4-2-2-New"
4,2,2,"New","so they’re blazing down the road",NA,NA,NA,"4-2-2-New"
4,2,2,"New","and it stops  on roadrunner",NA,NA,NA,"4-2-2-New"
4,2,2,"New","and it says roadrunner",NA,NA,NA,"4-2-2-New"
4,2,2,"New","and then like speed increbulus or something in the bottom",NA,"like, or something",NA,"4-2-2-New"
4,2,2,"New","something they’re trying to pretend it’s Latin",NA,NA,NA,"4-2-2-New"
4,2,2,"New","and it goes up to wile e. coyote",NA,NA,NA,"4-2-2-New"
4,2,2,"New","it says under him wile e. coyote",NA,NA,NA,"4-2-2-New"
4,2,2,"New","and then some other made up Latin",NA,NA,NA,"4-2-2-New"
4,2,2,"New","and then start going slowly again and they take off",NA,NA,NA,"4-2-2-New"
4,2,2,"New","and they’re running incredibly fast on the road",NA,NA,NA,"4-2-2-New"
4,2,2,"New","and you see wile e. coyote has a uh fork and a knife in his hands ?",NA,NA,"?","4-2-2-New"
4,2,2,"New","he makes a lunge trying to stab him down the road runner ?",NA,NA,"?","4-2-2-New"
4,2,2,"New","the roadrunner just takes off even faster",NA,NA,NA,"4-2-2-New"
4,2,2,"New","and just hits the ground",NA,"just",NA,"4-2-2-New"
4,2,2,"New","so he comes up with a plan",NA,NA,NA,"4-2-2-New"
4,2,2,"New","he decides to go take a boxing glove",NA,NA,NA,"4-2-2-New"
4,2,2,"New","put a spring in it attach the other end of the spring to a uh rock",NA,NA,NA,"4-2-2-New"
4,2,2,"New","he pulls it back",NA,NA,NA,"4-2-2-New"
4,2,2,"New","and hooks it against the rock so it won’t fly out",NA,NA,NA,"4-2-2-New"
4,2,2,"New","until he lets go of the hook",NA,NA,NA,"4-2-2-New"
4,2,2,"New","he hides behind the rock",NA,NA,NA,"4-2-2-New"
4,2,2,"New","he’s gonna wait for the roadrunner to come by",NA,NA,NA,"4-2-2-New"
4,2,2,"New","and he’ll pull the hook",NA,NA,NA,"4-2-2-New"
4,2,2,"New","the boxing glove will fly out",NA,NA,NA,"4-2-2-New"
4,2,2,"New","and hit the roadrunner",NA,NA,NA,"4-2-2-New"
4,2,2,"New","so he’s hiding behind the rock",NA,NA,NA,"4-2-2-New"
4,2,2,"New","and you hear the roadrunner coming",NA,NA,NA,"4-2-2-New"
4,2,2,"New","and you hear him going BEEP BEEP",NA,NA,NA,"4-2-2-New"
4,2,2,"New","and you hear the wind tearing by him",NA,NA,NA,"4-2-2-New"
4,2,2,"New","so he lets go of the hook at the right moment",NA,NA,NA,"4-2-2-New"
4,2,2,"New","but instead of the boxing glove shooting forward the rock shoots back",NA,NA,NA,"4-2-2-New"
4,2,2,"New","and flies him into a wall so now he’s smashed against the wall",NA,NA,NA,"4-2-2-New"
4,2,2,"New","and then you see him look panicked",NA,NA,NA,"4-2-2-New"
4,2,2,"New","‘cause the boxing glove flies back now",NA,NA,NA,"4-2-2-New"
4,2,2,"New","and hits him in the face",NA,NA,NA,"4-2-2-New"
4,2,2,"New","so he comes up with a different plan this time",NA,NA,NA,"4-2-2-New"
4,2,2,"New","he decides he’s gonna put a tightrope between two cliffs",NA,NA,NA,"4-2-2-New"
4,2,2,"New","he’s gonna walk between them with a huge anvil in his hands",NA,NA,NA,"4-2-2-New"
4,2,2,"New","and he’ll drop it on the roadrunner when the roadrunner walks by",NA,NA,NA,"4-2-2-New"
4,2,2,"New","you see his blueprints and everything’s great",NA,NA,NA,"4-2-2-New"
4,2,2,"New","so he walks on the tightrope with the anvil",NA,NA,NA,"4-2-2-New"
4,2,2,"New","but the anv but the tightrope stretches down",NA,NA,NA,"4-2-2-New"
4,2,2,"New","and now he’s on the ground on the tightrope with an anvil in his hands",NA,NA,NA,"4-2-2-New"
4,2,2,"New","so he can’t drop it on anything",NA,NA,NA,"4-2-2-New"
4,2,2,"New","the roadrunner comes up",NA,NA,NA,"4-2-2-New"
4,2,2,"New","does his little BEEP BEEP",NA,NA,NA,"4-2-2-New"
4,2,2,"New","flies away",NA,NA,NA,"4-2-2-New"
4,2,2,"New","so the wil",NA,NA,NA,"4-2-2-New"
4,2,2,"New","so the coyote throws the anvil on the ground and goes chasing after him",NA,NA,NA,"4-2-2-New"
4,2,2,"New","but when he throws the anvil on the ground",NA,NA,NA,"4-2-2-New"
4,2,2,"New","the tightrope goes back to how it was shoots him up in the air",NA,NA,NA,"4-2-2-New"
4,2,2,"New","but he looks kind of confident now",NA,"kind of",NA,"4-2-2-New"
4,2,2,"New","and the camera pans to the side and you see that he’s got a parachute on",NA,NA,NA,"4-2-2-New"
4,2,2,"New","so he pulls the rope of the parachute when he starts going down",NA,NA,NA,"4-2-2-New"
4,2,2,"New","but instead of a parachute coming out random crap comes out",NA,"random crap",NA,"4-2-2-New"
4,2,2,"New","like an axe and a plate and a bowl and a spoon and a banana",NA,NA,NA,"4-2-2-New"
4,2,2,"New","you know whatnot not a parachute",NA,"you know, whatnot",NA,"4-2-2-New"
4,2,2,"New","so he’s flying down",NA,NA,NA,"4-2-2-New"
4,2,2,"New","he looks panicked",NA,NA,NA,"4-2-2-New"
4,2,2,"New","so he takes his acme uh aspirin",NA,NA,NA,"4-2-2-New"
4,2,2,"New","opens it up and",NA,NA,NA,"4-2-2-New"
4,2,2,"New","grabs a few out of the air",NA,NA,NA,"4-2-2-New"
4,2,2,"New","‘cause you know they’re all flying straight up",NA,"you know",NA,"4-2-2-New"
4,2,2,"New","and then he just waves goodbye to the camera",NA,"just",NA,"4-2-2-New"
4,2,2,"New","as he flies down",NA,NA,NA,"4-2-2-New"
4,2,2,"New","and hits the ground",NA,NA,NA,"4-2-2-New"
4,2,2,"New","and there’s a little mushroom cloud",NA,NA,NA,"4-2-2-New"
4,2,2,"New","and so this time thee roadrunner go",NA,NA,NA,"4-2-2-New"
4,2,2,"New","runs into the uh old cactus mine or something",NA,NA,NA,"4-2-2-New"
4,2,2,"New","and wile e. coyote chases after him",NA,NA,NA,"4-2-2-New"
4,2,2,"New","and he’s running after him through the mine and it gets pitch black",NA,NA,NA,"4-2-2-New"
4,2,2,"New","so he runs back to the beginning and he grabs one of those little hats",NA,NA,NA,"4-2-2-New"
4,2,2,"New","like those mining hats with the lights on",NA,"like",NA,"4-2-2-New"
4,2,2,"New","then the roadrunner flies up and the roadrunner has one too",NA,NA,NA,"4-2-2-New"
4,2,2,"New","and ru roadrunner’s light is green and the coyote’s is red",NA,NA,NA,"4-2-2-New"
4,2,2,"New","so they’re running after each other",NA,NA,NA,"4-2-2-New"
4,2,2,"New","and it switches from like seeing them to seeing sort of a bigger map?",NA,"like, sort of","?","4-2-2-New"
4,2,2,"New","with just their lights on it ?",NA,NA,"?","4-2-2-New"
4,2,2,"New","and you see them running through a map",NA,NA,NA,"4-2-2-New"
4,2,2,"New","thee roadrunner gets in an elevator",NA,NA,NA,"4-2-2-New"
4,2,2,"New","the coyote chases after him",NA,NA,NA,"4-2-2-New"
4,2,2,"New","they’re running around for a while",NA,NA,NA,"4-2-2-New"
4,2,2,"New","the roadrunner gets on a uh ladder",NA,NA,NA,"4-2-2-New"
4,2,2,"New","so the roadrunner goes up the coyote chases after him",NA,NA,NA,"4-2-2-New"
4,2,2,"New","the roadrunner goes down on the other side",NA,NA,NA,"4-2-2-New"
4,2,2,"New","and they’re just running in a circle for a while",NA,NA,NA,"4-2-2-New"
4,2,2,"New","but the roadrunner stops and then goes somewhere else",NA,NA,NA,"4-2-2-New"
4,2,2,"New","but the coyote is still running in a circle then he realizes it and stops",NA,NA,NA,"4-2-2-New"
4,2,2,"New","runs after the roadrunner",NA,NA,NA,"4-2-2-New"
4,2,2,"New","the roadrunner jumps a little gap and the coyote can’t quite jump it",NA,NA,NA,"4-2-2-New"
4,2,2,"New","so he grabs onto a cliff and just barely pulls himself up",NA,NA,NA,"4-2-2-New"
4,2,2,"New","and then they’re running in sort of a saw blade",NA,"sort of",NA,"4-2-2-New"
4,2,2,"New","so they like up down up down up down up down",NA,"like",NA,"4-2-2-New"
4,2,2,"New","and the coyote is chasing after him",NA,NA,NA,"4-2-2-New"
