"Triad","Narration","Listener","OldOrNew","Transcript","Audience","Hedges","Rising Intonation","ID"
18,3,2,"New","with the anvil in his hand",NA,NA,NA,"18-3-2-New"
18,3,2,"New","the roadrunner flies by",NA,NA,NA,"18-3-2-New"
18,3,2,"New","so he wants to go chase after him",NA,NA,NA,"18-3-2-New"
18,3,2,"New","so he throws the anvil",NA,NA,NA,"18-3-2-New"
18,3,2,"New","but the tightrope kinda flings him back up",NA,"kinda",NA,"18-3-2-New"
18,3,2,"New","and he goes flying into the air",NA,NA,NA,"18-3-2-New"
18,3,2,"New","and he’s like",NA,"like",NA,"18-3-2-New"
18,3,2,"New","basically you think crap he’s dead",NA,NA,NA,"18-3-2-New"
18,3,2,"New","but he um you",NA,NA,NA,"18-3-2-New"
18,3,2,"New","he turns and he’s got a parachute on his back",NA,NA,NA,"18-3-2-New"
18,3,2,"New","and so he’s like hahaha",NA,"like",NA,"18-3-2-New"
18,3,2,"New","I’m not dead",NA,NA,NA,"18-3-2-New"
18,3,2,"New","and he pulls the um cord",NA,NA,NA,"18-3-2-New"
18,3,2,"New","and instead of a parachute",NA,NA,NA,"18-3-2-New"
18,3,2,"New","it’s like a fork a knife an axe",NA,"like",NA,"18-3-2-New"
18,3,2,"New","like a bunch of things that obviously aren’t gonna save him",NA,"like, bunch of things",NA,"18-3-2-New"
18,3,2,"New","and you just see he",NA,"just",NA,"18-3-2-New"
18,3,2,"New","you just see him he pulls out like aspirin ?",NA,"just, like","?","18-3-2-New"
18,3,2,"New","puts um like takes like six aspirins",NA,"like, like",NA,"18-3-2-New"
18,3,2,"New","pops them",NA,"like,like",NA,"18-3-2-New"
18,3,2,"New","and then like waves bye",NA,"like",NA,"18-3-2-New"
18,3,2,"New","and falls to the ground",NA,NA,NA,"18-3-2-New"
18,3,2,"New","you see like a big POOF of smoke",NA,"like",NA,"18-3-2-New"
18,3,2,"New","so he’s dead",NA,NA,NA,"18-3-2-New"
18,3,2,"New","and then he comes back",NA,NA,NA,"18-3-2-New"
18,3,2,"New","and they’re running",NA,NA,NA,"18-3-2-New"
18,3,2,"New","he’s chasing the roadrunner again",NA,NA,NA,"18-3-2-New"
18,3,2,"New","to an old cactus mine",NA,NA,NA,"18-3-2-New"
18,3,2,"New","he runs into the mine",NA,NA,NA,"18-3-2-New"
18,3,2,"New","and he cha he’s chasing after the roadrunner",NA,NA,NA,"18-3-2-New"
18,3,2,"New","it’s pitch black",NA,NA,NA,"18-3-2-New"
18,3,2,"New","he can’t see anything",NA,NA,NA,"18-3-2-New"
18,3,2,"New","so he runs back to the beginning of the mine",NA,NA,NA,"18-3-2-New"
18,3,2,"New","where there’s hardhats",NA,NA,NA,"18-3-2-New"
18,3,2,"New","and it’s a hardhat with a light on it",NA,NA,NA,"18-3-2-New"
18,3,2,"New","and his light is red",NA,NA,NA,"18-3-2-New"
18,3,2,"New","and the roadrunner comes back",NA,NA,NA,"18-3-2-New"
18,3,2,"New","kind of mocking him ?",NA,"kind of","?","18-3-2-New"
18,3,2,"New","like haha you can’t get me ?",NA,"like","?","18-3-2-New"
18,3,2,"New","and he has a red light",NA,NA,NA,"18-3-2-New"
18,3,2,"New","then they kinda pull back to like a maze ?",NA,"kinda, like","?","18-3-2-New"
18,3,2,"New","of tunnels ? like all you see is like tunnels",NA,"like, like","?","18-3-2-New"
18,3,2,"New","just going all around the place",NA,"just",NA,"18-3-2-New"
18,3,2,"New","you don’t really",NA,NA,NA,"18-3-2-New"
18,3,2,"New","all you see is the lights",NA,NA,NA,"18-3-2-New"
18,3,2,"New","like the red light and the green light",NA,"like",NA,"18-3-2-New"
18,3,2,"New","of the roadrunner and the coyote",NA,NA,NA,"18-3-2-New"
18,3,2,"New","so all you see is the red light the coyote",NA,NA,NA,"18-3-2-New"
18,3,2,"New","chasing after the green light the roadrunner",NA,NA,NA,"18-3-2-New"
18,3,2,"New","so they’re chasing through all these different tunnels",NA,NA,NA,"18-3-2-New"
18,3,2,"New","dadadadada",NA,NA,NA,"18-3-2-New"
18,3,2,"New","then all of a sudden they come to like kind of",NA,"like, kind of",NA,"18-3-2-New"
18,3,2,"New","they start going in a circle ?",NA,NA,"?","18-3-2-New"
18,3,2,"New","like the coyote is chasing after the roadrunner",NA,"like",NA,"18-3-2-New"
18,3,2,"New","in a circle",NA,NA,NA,"18-3-2-New"
18,3,2,"New","then all of a sudden the roadrunner stops",NA,NA,NA,"18-3-2-New"
18,3,2,"New","but the coyote’s still going",NA,NA,NA,"18-3-2-New"
18,3,2,"New","so you see just the red light going in a circle",NA,NA,NA,"18-3-2-New"
18,3,2,"New","around one of the the mi",NA,NA,NA,"18-3-2-New"
18,3,2,"New","around one of the tunnels",NA,NA,NA,"18-3-2-New"
18,3,2,"New","then he keeps going he keeps going",NA,NA,NA,"18-3-2-New"
18,3,2,"New","he’s uh the roadrunner stops",NA,NA,NA,"18-3-2-New"
18,3,2,"New","and all of a sudden he does that MEEP MEEP thing he does",NA,"thing",NA,"18-3-2-New"
18,3,2,"New","and the coyote comes",NA,NA,NA,"18-3-2-New"
18,3,2,"New","then the coyote stops",NA,NA,NA,"18-3-2-New"
18,3,2,"New","and starts chasing after him",NA,NA,NA,"18-3-2-New"
18,3,2,"New","then he starts going through",NA,NA,NA,"18-3-2-New"
18,3,2,"New","a m a tunnel that’s like going",NA,"like",NA,"18-3-2-New"
18,3,2,"New","up and down and up and down and up and down",NA,NA,NA,"18-3-2-New"
18,3,2,"New","so then all of a sudden the like tunnel goes straight",NA,"like",NA,"18-3-2-New"
18,3,2,"New","it’s not going up and down anymore ?",NA,NA,"?","18-3-2-New"
18,3,2,"New","and the roadrunner just keeps going up and down",NA,NA,NA,"18-3-2-New"
18,3,2,"New","hitting his head on the floor and on the top",NA,NA,NA,"18-3-2-New"
18,3,2,"New","on like the floor and the ceiling of like the tunnel",NA,"like, like",NA,"18-3-2-New"
18,3,2,"New","he loses his hardhat because he’s bumping up and down",NA,NA,NA,"18-3-2-New"
18,3,2,"New","and it’s pitch black",NA,NA,NA,"18-3-2-New"
18,3,2,"New","he can’t see anything",NA,NA,NA,"18-3-2-New"
18,3,2,"New","so he lights a match",NA,NA,NA,"18-3-2-New"
18,3,2,"New","and behind him in the match is all TNT explosives so",NA,NA,NA,"18-3-2-New"
18,3,2,"New","obviously it explodes",NA,NA,NA,"18-3-2-New"
18,3,2,"New","’cause the match made it explode",NA,NA,NA,"18-3-2-New"
18,3,2,"New","then outside",NA,NA,NA,"18-3-2-New"
18,3,2,"New","then they cut to likesomething outside ?",NA,"like, something","?","18-3-2-New"
18,3,2,"New","and it says the wo the cactuses form the word YIPE",NA,NA,NA,"18-3-2-New"
18,3,2,"New","and then that’s the end of the cartoon",NA,NA,NA,"18-3-2-New"
19,1,1,"New","okay so this cartoon was uh roadrunner and coyote ?",NA,NA,"?","19-1-1-New"
19,1,1,"New","so it starts off",NA,NA,NA,"19-1-1-New"
19,1,1,"New","you know they’re in the desert",NA,"you know",NA,"19-1-1-New"
19,1,1,"New","with that one two lane road",NA,NA,NA,"19-1-1-New"
19,1,1,"New","it’s uh it’s always one of them of course",NA,NA,NA,"19-1-1-New"
19,1,1,"New","and it’s roadrunner and he’s running",NA,NA,NA,"19-1-1-New"
19,1,1,"New","and coyote’s chasing him",NA,NA,NA,"19-1-1-New"
19,1,1,"New","and then they like there’s all this music",NA,"like",NA,"19-1-1-New"
19,1,1,"New","and then it stops",NA,NA,NA,"19-1-1-New"
19,1,1,"New","it freeze frames",NA,NA,NA,"19-1-1-New"
19,1,1,"New","and you know it shows roadrunner",NA,"you know",NA,"19-1-1-New"
19,1,1,"New","then it shows coyote",NA,NA,NA,"19-1-1-New"
19,1,1,"New","and he’s got this like knife and fork in his hands","mm-hmm","like",NA,"19-1-1-New"
19,1,1,"New","like you know",NA,"like, you know",NA,"19-1-1-New"
19,1,1,"New","and then they start running again",NA,NA,NA,"19-1-1-New"
19,1,1,"New","and he goes to grab him",NA,NA,NA,"19-1-1-New"
19,1,1,"New","and like he you know he hits the road of course",NA,"like, you know",NA,"19-1-1-New"
19,1,1,"New","and then like he sets up this other like",NA,"like, like",NA,"19-1-1-New"
19,1,1,"New","contraption trying to catch the roadrunner",NA,NA,NA,"19-1-1-New"
19,1,1,"New","and it’s like a boxing glove",NA,"like",NA,"19-1-1-New"
19,1,1,"New","attached to a spring ?","okay",NA,"?","19-1-1-New"
19,1,1,"New","so like you know it’d shoot out ?",NA,"like, you know","?","19-1-1-New"
19,1,1,"New","aand that’s attached to like this rock",NA,"like, you know",NA,"19-1-1-New"
19,1,1,"New","and he stands behind the rock",NA,NA,NA,"19-1-1-New"
19,1,1,"New","aand he’s got this string",NA,NA,NA,"19-1-1-New"
19,1,1,"New","ready to like pull it",NA,"like",NA,"19-1-1-New"
19,1,1,"New","so it would knock roadrunner out",NA,NA,NA,"19-1-1-New"
19,1,1,"New","aand you know roadrunner goes by",NA,"you know",NA,"19-1-1-New"
19,1,1,"New","he pulls the string",NA,NA,NA,"19-1-1-New"
19,1,1,"New","and instead of the boxing glove going out",NA,NA,NA,"19-1-1-New"
19,1,1,"New","the rock goes back",NA,NA,NA,"19-1-1-New"
19,1,1,"New","and then like the boxing glove like hits him in the face",NA,"like, like",NA,"19-1-1-New"
19,1,1,"New","then he um he like pulls out these blueprints of",NA,"like",NA,"19-1-1-New"
19,1,1,"New","like these cliffs",NA,"like",NA,"19-1-1-New"
19,1,1,"New","and like a tightrope thing",NA,"like, thing",NA,"19-1-1-New"
19,1,1,"New","and he’s you know gonna walk across",NA,"you know",NA,"19-1-1-New"
19,1,1,"New","with this anvil",NA,NA,NA,"19-1-1-New"
19,1,1,"New","aand you know then they show the cliffs",NA,"you know",NA,"19-1-1-New"
19,1,1,"New","and you know he starts to walk across with the anvil",NA,"you know",NA,"19-1-1-New"
19,1,1,"New","and the tightrope you know goes down",NA,"you know",NA,"19-1-1-New"
19,1,1,"New","it sinks all the way down to the road",NA,NA,NA,"19-1-1-New"
19,1,1,"New","and roadrunner comes up",NA,NA,NA,"19-1-1-New"
19,1,1,"New","and he’s like you know MEEP MEEP kind of",NA,"like, you know, kind of",NA,"19-1-1-New"
19,1,1,"New","you know that thing",NA,"you know, that thing",NA,"19-1-1-New"
19,1,1,"New","aand then coyote he like throws the anvil off",NA,"like",NA,"19-1-1-New"
19,1,1,"New","of you know from holding it ?",NA,"you know","?","19-1-1-New"
19,1,1,"New","and he shoots up into the air",NA,NA,NA,"19-1-1-New"
19,1,1,"New","and he’s like ah you know",NA,"like, you know",NA,"19-1-1-New"
19,1,1,"New","then he like points to his back",NA,"like",NA,"19-1-1-New"
19,1,1,"New","and he’s you know fine",NA,"you know",NA,"19-1-1-New"
19,1,1,"New","’cause he’s got like this parachute ?",NA,"like","?","19-1-1-New"
19,1,1,"New","and he goes to open it",NA,NA,NA,"19-1-1-New"
19,1,1,"New","and like all of his cooking supplies",NA,"like",NA,"19-1-1-New"
19,1,1,"New","like paans and stuff like that",NA,"like, stuff like that",NA,"19-1-1-New"
19,1,1,"New","come flying out",NA,NA,NA,"19-1-1-New"
19,1,1,"New","so then he pulls out this aspirin",NA,NA,NA,"19-1-1-New"
19,1,1,"New","and like he you know he just takes some",NA,"like, you know, just",NA,"19-1-1-New"
19,1,1,"New","and hits the ground",NA,NA,NA,"19-1-1-New"
19,1,1,"New","the WHHHHHHHHOOO PPSSSSH!!! kind of a thing",NA,"kind of a thing",NA,"19-1-1-New"
19,1,1,"New","and uh then he like",NA,"like",NA,"19-1-1-New"
19,1,1,"New","coyote chases the roadrunner into these mines ?",NA,NA,"?","19-1-1-New"
19,1,1,"New","aand he you know he grabs like a",NA,"you know, like",NA,"19-1-1-New"
19,1,1,"New","like a mineworker’ s hat",NA,"like",NA,"19-1-1-New"
19,1,1,"New","with the little light on it ?","mm-hmm",NA,"?","19-1-1-New"
19,1,1,"New","he had a red light on his and roadrunner had a green light on his",NA,NA,NA,"19-1-1-New"
19,1,1,"New","and then they went to like this cross section kind of ?",NA,"like, kind of","?","19-1-1-New"
19,1,1,"New","of the mine",NA,NA,NA,"19-1-1-New"
19,1,1,"New","like it was just I don’t know just c bunch of tunnels kind of thing",NA,"like, I don't know, just, kind of thing",NA,"19-1-1-New"
19,1,1,"New","and all you saw was like the green light going around",NA,"like",NA,"19-1-1-New"
19,1,1,"New","and the red light following it",NA,NA,NA,"19-1-1-New"
19,1,1,"New","and you know green light would go this way",NA,"you know",NA,"19-1-1-New"
19,1,1,"New","and then the red light would have to stop and go back",NA,NA,NA,"19-1-1-New"
19,1,1,"New","and theen you know",NA,"you know",NA,"19-1-1-New"
19,1,1,"New","the green light went into a different type of tunnel",NA,NA,NA,"19-1-1-New"
19,1,1,"New","like the tunnels ran like this","mm-hmm","like",NA,"19-1-1-New"
19,1,1,"New","as opposed to like the box that they were in",NA,"like",NA,"19-1-1-New"
19,1,1,"New","aand then at the end of like that type of tunnel",NA,"like, type of",NA,"19-1-1-New"
19,1,1,"New","the squiggly ? whatever",NA,"whatever","?","19-1-1-New"
19,1,1,"New","um he like",NA,"like",NA,"19-1-1-New"
19,1,1,"New","roadrunner goes up one way",NA,NA,NA,"19-1-1-New"
19,1,1,"New","and coyote goes like you know",NA,"like, you know",NA,"19-1-1-New"
19,1,1,"New","it’s like one is going this way and one’s going that way",NA,"like",NA,"19-1-1-New"
19,1,1,"New","and coyote goes on that way straight away",NA,NA,NA,"19-1-1-New"
19,1,1,"New","and he ends up in the pitch black",NA,NA,NA,"19-1-1-New"
19,1,1,"New","so he like lights a match",NA,"like",NA,"19-1-1-New"
19,1,1,"New","and he’s in a room full of TNT","didn’t he have the red light ?",NA,NA,"19-1-1-New"
19,1,1,"New","yeah","okay",NA,NA,"19-1-1-New"
19,1,1,"New","it it went out",NA,NA,NA,"19-1-1-New"
19,1,1,"New","I mean I don’t know it’s a cartoon",NA,"I mean, I don't know",NA,"19-1-1-New"
19,1,1,"New","but uh you know he lights this match",NA,"you know",NA,"19-1-1-New"
19,1,1,"New","and it’s you know in a room full of TNT",NA,"you know",NA,"19-1-1-New"
19,1,1,"New","aand you know blows up",NA,"you know",NA,"19-1-1-New"
19,1,1,"New","and like you see the cact the cacti ?",NA,"like","?","19-1-1-New"
19,1,1,"New","yeah the cacti ?",NA,NA,"?","19-1-1-New"
19,1,1,"New","like on top it says YIPE afterwards",NA,"like",NA,"19-1-1-New"
19,1,1,"New","and that’s how it ends","okay",NA,NA,"19-1-1-New"
19,2,1,"Old","alright so uh roadrunner coyote ?",NA,NA,"?","19-2-1-Old"
19,2,1,"Old","starts off in a desert",NA,NA,NA,"19-2-1-Old"
19,2,1,"Old","with the you know two lane roads",NA,"you know",NA,"19-2-1-Old"
19,2,1,"Old","you know",NA,"you know",NA,"19-2-1-Old"
19,2,1,"Old","aand there’s music going you know",NA,"you know",NA,"19-2-1-Old"
19,2,1,"Old","they’re chasing each other",NA,NA,NA,"19-2-1-Old"
19,2,1,"Old","roadrunner",NA,NA,NA,"19-2-1-Old"
19,2,1,"Old","coyote’s chasing the roadrunner",NA,NA,NA,"19-2-1-Old"
19,2,1,"Old","and it freeze frames",NA,NA,NA,"19-2-1-Old"
19,2,1,"Old","and roadrunner you know it’s it shows him",NA,"you know",NA,"19-2-1-Old"
19,2,1,"Old","and then it shows coyote",NA,NA,NA,"19-2-1-Old"
19,2,1,"Old","and it shows him with like the knife and the fork",NA,"like",NA,"19-2-1-Old"
19,2,1,"Old","and then it goes back to like them chasing",NA,"like",NA,"19-2-1-Old"
19,2,1,"Old","well coyote chasing roadrunner",NA,NA,NA,"19-2-1-Old"
19,2,1,"Old","aand then he like goes for him",NA,"like",NA,"19-2-1-Old"
19,2,1,"Old","and you know he hits the the road",NA,"you know",NA,"19-2-1-Old"
19,2,1,"Old","pavement whatever",NA,"whatever",NA,"19-2-1-Old"
19,2,1,"Old","and then like he devises this other plan",NA,"like",NA,"19-2-1-Old"
19,2,1,"Old","with uh a boxing glove attached to the spring",NA,NA,NA,"19-2-1-Old"
19,2,1,"Old","which is attached to a rock",NA,NA,NA,"19-2-1-Old"
19,2,1,"Old","and you know",NA,"you know",NA,"19-2-1-Old"
19,2,1,"Old","he gets behind the rock",NA,NA,NA,"19-2-1-Old"
19,2,1,"Old","he pulls the boxing glove back",NA,NA,NA,"19-2-1-Old"
19,2,1,"Old","and he’s ready for roadrunner to come",NA,NA,NA,"19-2-1-Old"
19,2,1,"Old","and to knock him out",NA,NA,NA,"19-2-1-Old"
19,2,1,"Old","and when he pulls the string",NA,NA,NA,"19-2-1-Old"
19,2,1,"Old","the rock shoots back",NA,NA,NA,"19-2-1-Old"
19,2,1,"Old","instead of the boxing glove shooting forward",NA,NA,NA,"19-2-1-Old"
19,2,1,"Old","and then like you know the boxing glove just hits him in the face",NA,"like, you know",NA,"19-2-1-Old"
19,2,1,"Old","and then it goes to like these blueprints of",NA,"like",NA,"19-2-1-Old"
19,2,1,"Old","like these cliffs",NA,"like",NA,"19-2-1-Old"
19,2,1,"Old","and like a rope",NA,"like",NA,"19-2-1-Old"
19,2,1,"Old","you know going across them",NA,"you know",NA,"19-2-1-Old"
19,2,1,"Old","and like him standing in the middle",NA,"like",NA,"19-2-1-Old"
19,2,1,"Old","and then it shows like the actual cliffs",NA,"like",NA,"19-2-1-Old"
19,2,1,"Old","and him walking with the",NA,NA,NA,"19-2-1-Old"
19,2,1,"Old","like starting to walk across with this anvil in his hands",NA,"like",NA,"19-2-1-Old"
19,2,1,"Old","and like the tightrope goes down",NA,"like",NA,"19-2-1-Old"
19,2,1,"Old","all the way down to the ground",NA,NA,NA,"19-2-1-Old"
19,2,1,"Old","and roadrunner comes up",NA,NA,NA,"19-2-1-Old"
19,2,1,"Old","and he’s like MEEP MEEP",NA,"like",NA,"19-2-1-Old"
19,2,1,"Old","and you know he he",NA,"you know",NA,"19-2-1-Old"
19,2,1,"Old","coyote throws the anvil",NA,NA,NA,"19-2-1-Old"
19,2,1,"Old","and he goes shooting up into the air",NA,NA,NA,"19-2-1-Old"
19,2,1,"Old","but you know he’s fine with it",NA,"you know",NA,"19-2-1-Old"
19,2,1,"Old","’cause he’s like ah I got this backpack",NA,"like",NA,"19-2-1-Old"
19,2,1,"Old","you know well parachute",NA,"you know",NA,"19-2-1-Old"
19,2,1,"Old","and he goes to open it",NA,NA,NA,"19-2-1-Old"
19,2,1,"Old","and it’s just a bunch of cooking apparel",NA,NA,NA,"19-2-1-Old"
19,2,1,"Old","and pans and you know stuff like that",NA,"you know, stuff like that",NA,"19-2-1-Old"
19,2,1,"Old","and then like he pulls out this aspirin",NA,"like",NA,"19-2-1-Old"
19,2,1,"Old","and he takes it",NA,NA,NA,"19-2-1-Old"
19,2,1,"Old","and you know plummets down",NA,"you know",NA,"19-2-1-Old"
19,2,1,"Old","hits it PFFFT",NA,NA,NA,"19-2-1-Old"
19,2,1,"Old","aand then he’s uh",NA,NA,NA,"19-2-1-Old"
19,2,1,"Old","he like follows roadrunner into like these mines",NA,"like, like",NA,"19-2-1-Old"
19,2,1,"Old","he you know he gets a hat",NA,"you know",NA,"19-2-1-Old"
19,2,1,"Old","his hat has like this red light",NA,"like, like",NA,"19-2-1-Old"
19,2,1,"Old","for roadrunner’s hat is like this green light",NA,"like, like",NA,"19-2-1-Old"
19,2,1,"Old","and you know",NA,"you know",NA,"19-2-1-Old"
19,2,1,"Old","then they show like this cross-section of these tunnels",NA,"like, like",NA,"19-2-1-Old"
19,2,1,"Old","like almost like a tic-tac-toe",NA,"like, like",NA,"19-2-1-Old"
19,2,1,"Old","well not really",NA,NA,NA,"19-2-1-Old"
19,2,1,"Old","but you know",NA,"you know",NA,"19-2-1-Old"
19,2,1,"Old","then you see the red light chasing the green light",NA,NA,NA,"19-2-1-Old"
19,2,1,"Old","and the green light will go one way",NA,NA,NA,"19-2-1-Old"
19,2,1,"Old","the red light will have to stop go back",NA,NA,NA,"19-2-1-Old"
19,2,1,"Old","and then it shows a different set of tunnels",NA,NA,NA,"19-2-1-Old"
19,2,1,"Old","like a like a zigzag kind of thing",NA,"like, like, kind of, thing",NA,"19-2-1-Old"
19,2,1,"Old","and then at the end of the zigzag tunnel",NA,NA,NA,"19-2-1-Old"
19,2,1,"Old","like you know roadrunner goes one way",NA,"like, you know",NA,"19-2-1-Old"
19,2,1,"Old","and coyote goes like on a straight way",NA,"like, you know",NA,"19-2-1-Old"
19,2,1,"Old","and then you know it becomes pitch black",NA,"you know",NA,"19-2-1-Old"
19,2,1,"Old","aand hee lights a match",NA,NA,NA,"19-2-1-Old"
19,2,1,"Old","and he’s in a room full of TNT",NA,NA,NA,"19-2-1-Old"
19,2,1,"Old","so he blows up",NA,NA,NA,"19-2-1-Old"
19,2,1,"Old","and then like all you see is like",NA,"like, like",NA,"19-2-1-Old"
19,2,1,"Old","the cactus cacti um like say YIPE",NA,"like",NA,"19-2-1-Old"
19,2,1,"Old","it blows up …",NA,NA,NA,"19-2-1-Old"
19,3,2,"New","okay so this cartoon was uh the roadrunner",NA,NA,NA,"19-3-2-New"
19,3,2,"New","and coyote ?","mm-hmm",NA,"?","19-3-2-New"
19,3,2,"New","aand it starts off",NA,NA,NA,"19-3-2-New"
19,3,2,"New","you know it’s in the desert",NA,"you know",NA,"19-3-2-New"
19,3,2,"New","with that one road",NA,NA,NA,"19-3-2-New"
19,3,2,"New","and you know it’s a two lane road",NA,"you know",NA,"19-3-2-New"
19,3,2,"New","aand it’s roadrunner being chased by coyote",NA,NA,NA,"19-3-2-New"
19,3,2,"New","and then it freeze frames",NA,NA,NA,"19-3-2-New"
19,3,2,"New","and it shows roadrunner",NA,NA,NA,"19-3-2-New"
19,3,2,"New","and then it shows coyote",NA,NA,NA,"19-3-2-New"
19,3,2,"New","and coyote’s got like this knife and fork in his hands",NA,"like",NA,"19-3-2-New"
19,3,2,"New","aand then it shows them running again",NA,NA,NA,"19-3-2-New"
19,3,2,"New","and he like goes to grab him",NA,"like",NA,"19-3-2-New"
19,3,2,"New","but he you know he hits the road",NA,"you know",NA,"19-3-2-New"
19,3,2,"New","with the knife and fork",NA,NA,NA,"19-3-2-New"
19,3,2,"New","and then he’s like",NA,"like",NA,"19-3-2-New"
19,3,2,"New","he’s  devising another plan that uh",NA,NA,NA,"19-3-2-New"
19,3,2,"New","involves like this boxing glove ?",NA,"like","?","19-3-2-New"
19,3,2,"New","attached to a spring ?",NA,NA,"?","19-3-2-New"
19,3,2,"New","which is like attached to a rock ?",NA,"like","?","19-3-2-New"
19,3,2,"New","so likeyou know",NA,NA,"?, ?","19-3-2-New"
19,3,2,"New","it’d knock roadrunner ? out pretty much ?",NA,NA,NA,"19-3-2-New"
19,3,2,"New","so he’s standing behind this rock",NA,NA,NA,"19-3-2-New"
19,3,2,"New","waiting for him you know with the string",NA,"you know",NA,"19-3-2-New"
19,3,2,"New","and when roadrunner comes",NA,NA,NA,"19-3-2-New"
19,3,2,"New","he pulls the string",NA,NA,NA,"19-3-2-New"
19,3,2,"New","and instead of the boxing glove going out",NA,NA,NA,"19-3-2-New"
19,3,2,"New","the rock shoots him back",NA,NA,NA,"19-3-2-New"
19,3,2,"New","and like you know crashes him","mm-hmm","like, you know",NA,"19-3-2-New"
19,3,2,"New","and then the boxing glove hits him in the face",NA,NA,NA,"19-3-2-New"
19,3,2,"New","aand then he’s like got these blueprints",NA,"like",NA,"19-3-2-New"
19,3,2,"New","coyote’s got these blue blueprints",NA,NA,NA,"19-3-2-New"
19,3,2,"New","aand it shows like these two cliffs",NA,"like",NA,"19-3-2-New"
19,3,2,"New","with you know and a tightrope",NA,"you know",NA,"19-3-2-New"
19,3,2,"New","and an anvil",NA,NA,NA,"19-3-2-New"
19,3,2,"New","and then it shows like the actual cliffs",NA,"like",NA,"19-3-2-New"
19,3,2,"New","and he’s starting to walk across this tightrope",NA,NA,NA,"19-3-2-New"
19,3,2,"New","with this anvil",NA,NA,NA,"19-3-2-New"
19,3,2,"New","and the tightrope you know it drops all the way down to the road",NA,"you know",NA,"19-3-2-New"
19,3,2,"New","it’s heavy and stuff",NA,NA,NA,"19-3-2-New"
19,3,2,"New","and then roadrunner comes up",NA,NA,NA,"19-3-2-New"
19,3,2,"New","and he’s like MEEP MEEP",NA,"like",NA,"19-3-2-New"
19,3,2,"New","aand coyote you know he drops the anvil",NA,"you know",NA,"19-3-2-New"
19,3,2,"New","and he gets shot up into the air",NA,NA,NA,"19-3-2-New"
19,3,2,"New","you know really high",NA,"you know",NA,"19-3-2-New"
19,3,2,"New","and he point to his back",NA,NA,NA,"19-3-2-New"
19,3,2,"New","and he’s got like this parachute ?",NA,"like","?","19-3-2-New"
19,3,2,"New","backpack thing on",NA,"thing",NA,"19-3-2-New"
19,3,2,"New","and you know he’s like ah you know I’m fine",NA,"you know, like, you know",NA,"19-3-2-New"
19,3,2,"New","and he goes to pull it",NA,NA,NA,"19-3-2-New"
19,3,2,"New","and all of this cooking supplies comes out",NA,NA,NA,"19-3-2-New"
19,3,2,"New","like paans and stuff like that",NA,"like, and stuff like that",NA,"19-3-2-New"
19,3,2,"New","so then he just pulls out some aspirin",NA,"just",NA,"19-3-2-New"
19,3,2,"New","and you know takes them",NA,"you know",NA,"19-3-2-New"
19,3,2,"New","and then you know it’s like WHHHHHOOO POOOF",NA,"you know",NA,"19-3-2-New"
19,3,2,"New","you know that","mm-hmm","you know",NA,"19-3-2-New"
19,3,2,"New","aand then uh",NA,NA,NA,"19-3-2-New"
19,3,2,"New","he uh like chases roadrunner into the mi",NA,"like",NA,"19-3-2-New"
19,3,2,"New","like this mine",NA,"like",NA,"19-3-2-New"
19,3,2,"New","aand he grabs like one of those mine worker helmets",NA,"like",NA,"19-3-2-New"
19,3,2,"New","and coyote’s got this red light on his",NA,NA,NA,"19-3-2-New"
19,3,2,"New","and roadrunner’s got like this green light on his",NA,"like",NA,"19-3-2-New"
19,3,2,"New","so like they show this cross-section of the different tunnels",NA,"like",NA,"19-3-2-New"
19,3,2,"New","likekind oflike square",NA,"like, kind of, like",NA,"19-3-2-New"
19,3,2,"New","and you know",NA,"you know",NA,"19-3-2-New"
19,3,2,"New","but you know",NA,"you know",NA,"19-3-2-New"
19,3,2,"New","they just show the green light going around and around",NA,NA,NA,"19-3-2-New"
19,3,2,"New","and the show the red light going around and around","mm-hmm",NA,NA,"19-3-2-New"
19,3,2,"New","and then like next is like",NA,"like, like",NA,"19-3-2-New"
19,3,2,"New","they’re going through this like zigzag tunnel",NA,"like, like",NA,"19-3-2-New"
19,3,2,"New","and like it’s the green light going",NA,"like, like",NA,"19-3-2-New"
19,3,2,"New","and then the red light going",NA,NA,NA,"19-3-2-New"
19,3,2,"New","and at the end of the zigzag tunnel",NA,NA,NA,"19-3-2-New"
19,3,2,"New","it’s like one tunnel is going this way",NA,"like",NA,"19-3-2-New"
19,3,2,"New","and another tunnel is like going straight ?",NA,"like","?","19-3-2-New"
19,3,2,"New","and roadrunner goes like up",NA,"like",NA,"19-3-2-New"
19,3,2,"New","you know the green light goes up",NA,"you know",NA,"19-3-2-New"
19,3,2,"New","and the red light goes straight",NA,NA,NA,"19-3-2-New"
19,3,2,"New","and then it’s like",NA,"like",NA,"19-3-2-New"
19,3,2,"New","he’s in a pitch black room ?",NA,NA,"?","19-3-2-New"
19,3,2,"New","his light went out I guess",NA,"I guess",NA,"19-3-2-New"
19,3,2,"New","and he lights this match",NA,NA,NA,"19-3-2-New"
19,3,2,"New","and he’s in a room full of TNT",NA,NA,NA,"19-3-2-New"
19,3,2,"New","so it blows up",NA,NA,NA,"19-3-2-New"
19,3,2,"New","aand you know you see these uh cacti",NA,"you know",NA,"19-3-2-New"
19,3,2,"New","you know that were on top",NA,"you know",NA,"19-3-2-New"
19,3,2,"New","like blow up and then say YIPE",NA,"like",NA,"19-3-2-New"
19,3,2,"New","afterwards when the fall back down","ah okay and that’s it",NA,NA,"19-3-2-New"
19,3,2,"New","yeah",NA,NA,NA,"19-3-2-New"
2,1,1,"New","so the cartoon that I saw was about the roadrunner ?",NA,NA,"?","2-1-1-New"
